paper_id,title,year,authors,venue,venue_id,venue_name,venue_acronym,venue_type,venue_track,raw_venue,doi,arxiv_id,openalex_url,paper_url,publication_type,abstract,task,subtask,scope_status,source_database,metadata_source,curation_status,review_status,review_note,created_at,updated_at,entry_type
curated:988373de555945528142,"Comparative Analysis of Deepfake Image Detection Method Using VGG16, VGG19 and ResNet50",2024,Zahra Nazemi Ashani,Journal of Advanced Research in Applied Sciences and Engineering Technology,venue:journal-of-advanced-research-in-applied-sciences-and-engineering-technology:main,Journal of Advanced Research in Applied Sciences and Engineering Technology,,journal,main,Journal of Advanced Research in Applied Sciences and Engineering Technology,10.37934/araset.47.1.1628,,https://openalex.org/W4399978626,https://doi.org/10.37934/araset.47.1.1628,journal,"In the rapidly evolving digital landscape, the proliferation of online image and video sharing has reached unprecedented levels. This surge has been accompanied by the emergence of deepfake technology, powered by generative adversarial networks and deep learning techniques, enabling the creation of highly realistic fabricated images and videos. Consequently, the widespread dissemination of deepfake content on social media platforms has prompted the global community to seek effective methods for detecting and combating this issue. Recognizing that Artificial Intelligence (AI) has played a significant role in propagating deepfake challenges, researchers and experts believe that AI can also provide viable solutions. In this study, we explore the application of AI for deepfake image detection. Specifically, we focus on three convolutional neural network (CNN) algorithms—VGG16, VGG19, and ResNet—for this purpose. To evaluate the performance of these CNN models, a dataset comprising 1,200 images, including a combination of fake and real images, was utilized. The deepfake images were generated using FaceApp, a prominent tool for creating manipulated visuals. Our findings demonstrate that VGG19 outperforms both VGG16 and ResNet50, achieving an impressive accuracy rate of 98% on the test dataset when small size is small. By harnessing the power of AI, particularly through the application of CNN algorithms, this research makes a significant contribution to the field of deepfake image detection. The results underscore the efficacy of VGG19 in accurately identifying manipulated images, thereby providing valuable insights for the development of robust detection systems to combat the proliferation of deepfakes in today's digital world.",detection,deepfake_image_detection,in_scope,openalex,openalex,corrected_by_admin,reviewed,,2026-07-12T11:55:24Z,2026-07-12T11:55:24Z,analysis
curated:9a95c96ee1d20e56c56d,Spatial flatness-curvature mask driven generalized detection of synthetic images,2026,Tanusree Ghosh; Ruchira Naskar,Pattern Recognition Letters,venue:pattern-recognition-letters:main,Pattern Recognition Letters,PRL,journal,main,Pattern Recognition Letters,10.1016/j.patrec.2026.04.022,,https://openalex.org/W7155528736,https://doi.org/10.1016/j.patrec.2026.04.022,journal,"The proliferation of highly realistic images from generative models like GANs and Diffusion Models presents a significant challenge for digital trust, necessitating robust detectors that can generalize to unseen forgery sources. Many existing methods fail this generalization test, often by overfitting to source-specific artifacts that do not persist across different generator architectures. In this work, we focus on universal spatial artefacts related to the texture inherent in virtually all generative models. We propose that these artifacts can be effectively captured by analyzing local image regions for ‘flatness’ and ‘curvature’. We introduce a simple threshold-based method that first converts an input image into a six-channel ‘flatness-curvature mask’, a representation that explicitly highlights low-gradient (flat) and high-curvature regions. This artefact-rich feature representation can be utilised with any off-the-shelf classifier. Extensive experiments on benchmark datasets covering 38 distinct GAN and Diffusion models show that our method, along with the MobileViT classifier, when trained only on four classes of ProGAN images, achieves a mean accuracy of 87.2%. This marks a 23.7% improvement over baseline, demonstrating that our feature representation drastically improves generalization for standard classifiers.",detection,ai_generated_image_detection,in_scope,openalex,openalex,manually_confirmed,reviewed,,2026-07-12T11:57:28Z,2026-07-12T11:57:28Z,method
curated:161b6d5ca391d238f7e9,Detecting Origin Attribution for Text-to-Image Diffusion Models,2025,Katherine Xu; Lingzhi Zhang; Jianbo Shi,IEEE/CVF Winter Conference on Applications of Computer Vision,venue:wacv:main,IEEE/CVF Winter Conference on Applications of Computer Vision,WACV,conference,main,2025 IEEE/CVF Winter Conference on Applications of Computer Vision (WACV),10.1109/wacv61041.2025.00850,2403.19653,https://openalex.org/W4409262697,https://doi.org/10.1109/wacv61041.2025.00850,conference,"Modern text-to-image (T2I) diffusion models can generate images with remarkable realism and creativity. These advancements have sparked research in fake image detection and attribution, yet prior studies have not fully explored the practical and scientific dimensions of this task. In addition to attributing images to 12 state-of-the-art T2I generators, we provide extensive analyses on what inference stage hyperparameters and image modifications are discernible. Our experiments reveal that initialization seeds are highly detectable, along with other subtle variations in the image generation process to some extent. We further investigate what visual traces are leveraged in image attribution by perturbing high-frequency details and employing mid-level representations of image style and structure. Notably, altering high-frequency information causes only slight reductions in accuracy, and training an attributor on style representations outperforms training on RGB images. Our analyses underscore that fake images are detectable and attributable at various levels of visual granularity.",source_attribution,source_identification,in_scope,openalex,openalex,corrected_by_admin,reviewed,,2026-07-12T12:04:51Z,2026-07-12T12:04:51Z,analysis
curated:c87f234ea256991903e1,Dissect and Prune: Enhancing Robustness in AI-Generated Image Detection,2026,Dahye Kim; Jaehyun Choi; Hyun Seok Seong; Seongho Kim; Donghun Lee; Sungwon Yi; Jang-Ho Choi,International Conference on Machine Learning,venue:icml:main,International Conference on Machine Learning,ICML,conference,main,International Conference on Machine Learning (ICML),10.48550/arxiv.2606.10309,2606.10309,https://openalex.org/W7164168158,https://doi.org/10.48550/arxiv.2606.10309,conference,"While existing AI-generated image detectors report high performance, we identify that this is largely driven by a critical prediction asymmetry: a bias toward the real class that severely limits sensitivity to generated content, especially under standard post-processing operations such as compression and resizing. We hypothesize that this stems from the model's reliance on spurious features, distracting signals that obscure true generative artifacts. To address this, we propose DEAR (Dissect and Prune), which leverages inpainted images to identify and prune these interfering components. Specifically, we find that features strongly aligned to either inpainted or non-inpainted regions are less robust to post-processing. By measuring the alignment between channel activations and inpaint masks, DEAR removes features at both extremes, retaining only those that capture genuine generative artifacts. Experimental results demonstrate that our approach significantly enhances robustness against unseen generators and post-processing, effectively mitigating the prediction asymmetry. Our code is available at https://github.com/dahyedahye/dear.",detection,ai_generated_image_detection,in_scope,openalex,openalex,manually_confirmed,reviewed,,2026-07-12T12:09:50Z,2026-07-12T12:09:50Z,method
curated:078ade9edabe304013a7,ForensicConcept: Transferable Forensic Concepts for AIGI Detection,2026,Menyanshu Zhou; Ziyin Zhou; Ke Sun; Yunpeng Luo; Jiayi Ji; Xiaoshuai Sun; Rongrong Ji,International Conference on Machine Learning,venue:icml:main,International Conference on Machine Learning,ICML,conference,main,International Conference on Machine Learning (ICML),10.48550/arxiv.2606.07034,2606.07034,https://openalex.org/W7163898036,https://doi.org/10.48550/arxiv.2606.07034,conference,"AI-generated image detectors achieve high accuracy on in-distribution data but often fail on unseen generators. A key obstacle to understanding this failure is the black-box nature of current detectors: they do not reveal which evidence drives their decisions. We propose ForensicConcept, a framework that extracts explicit forensic concepts from detectors and enables their transfer across backbones. Our method localizes decision-critical patches via Transformer attribution, clusters them into a compact concept codebook, and uses a concept-aligned projection to produce auditable evidence readouts. Motivated by prior studies showing that DINO representations can guide diffusion generation and exhibit concept-level correspondence with diffusion features, we introduce a generation-trace reference based on CleanDIFT diffusion features and quantify backbone-trace alignment via neighborhood-structure consistency (CKNNA). We further propose concept codebook injection to transfer diffusion-derived concepts into target backbones. Experiments on GenImage, GAN-family, and Chameleon benchmarks show consistent improvements over prior methods. We also find that CKNNA alignment predicts transfer effectiveness, providing a principled explanation for why some backbones yield more transferable forensic evidence than others.",detection,ai_generated_image_detection,in_scope,openalex,openalex,manually_confirmed,reviewed,,2026-07-12T12:10:53Z,2026-07-12T12:10:53Z,method
curated:7ed4e932c4dac57d0136,DGS-Net: Distillation-Guided Gradient Surgery for CLIP Fine-Tuning in AI-Generated Image Detection,2026,"Yan, Jiazhen; Ziqiang Li; Fan Wang; Boyu Wang; He, Ziwen; Fu, Zhangjie",International Conference on Machine Learning,venue:icml:main,International Conference on Machine Learning,ICML,conference,main,International Conference on Machine Learning (ICML),10.48550/arxiv.2511.13108,2511.13108,https://openalex.org/W4416361369,https://arxiv.org/abs/2511.13108,conference,"The rapid progress of generative models such as GANs and diffusion models has led to the widespread proliferation of AI-generated images, raising concerns about misinformation, privacy violations, and trust erosion in digital media. Although large-scale multimodal models like CLIP offer strong transferable representations for detecting synthetic content, fine-tuning them often induces catastrophic forgetting, which degrades pre-trained priors and limits cross-domain generalization. To address this issue, we propose the Distillation-guided Gradient Surgery Network (DGS-Net), a novel framework that preserves transferable pre-trained priors while suppressing task-irrelevant components. Specifically, we introduce a gradient-space decomposition that separates harmful and beneficial descent directions during optimization. By projecting task gradients onto the orthogonal complement of harmful directions and aligning with beneficial ones distilled from a frozen CLIP encoder, DGS-Net achieves unified optimization of prior preservation and irrelevant suppression. Extensive experiments on 50 generative models demonstrate that our method outperforms state-of-the-art approaches by an average margin of 6.6, achieving superior detection performance and generalization across diverse generation techniques.",detection,ai_generated_image_detection,in_scope,openalex,openalex,manually_confirmed,reviewed,,2026-07-12T12:11:44Z,2026-07-12T12:11:44Z,method
curated:d6fe2666a64b0c70ff6b,GenShield: Unified Detection and Artifact Correction for AI-Generated Images,2026,Zhipei Xu; Xuanyu Zhang; Youmin Xu; Qing Huang; Shen Chen; Taiping Yao; Shouhong Ding; Jian Zhang,International Conference on Machine Learning,venue:icml:main,International Conference on Machine Learning,ICML,conference,main,International Conference on Machine Learning (ICML),10.48550/arxiv.2605.16122,2605.16122,https://openalex.org/W7161576865,https://doi.org/10.48550/arxiv.2605.16122,conference,"Diffusion-based image synthesis has made AI-generated images (AIGI) increasingly photorealistic, raising urgent concerns about authenticity in applications such as misinformation detection, digital forensics, and content moderation. Despite the substantial advances in AIGI detection, how to correct detected AI-generated images with visible artifacts and restore realistic appearance remains largely underexplored. Moreover, few existing work has established the connection between AIGI detection and artifact correction. To fill this gap, we propose GenShield, a unified autoregressive framework that jointly performs explainable AIGI detection and controllable artifact correction in a closed loop from diagnosis to restoration, revealing a mutually reinforcing relationship between these two tasks. We further introduce a Visual Chain-of-Thought based curriculum learning strategy that enables self-explained, multi-step ``diagnose-then-repair'' correction with an explicit stopping criterion. A high-quality dataset with large-scale ``artifact-restored'' pairs is also constructed alongside a unified evaluation pipeline. Extensive experiments on our correction benchmark and mainstream AIGI detection benchmarks demonstrate state-of-the-art performance and strong generalization of our method. The code is available at https://github.com/zhipeixu/GenShield.",detection,ai_generated_image_detection,in_scope,openalex,openalex,manually_confirmed,reviewed,,2026-07-12T12:12:32Z,2026-07-12T12:12:32Z,method
curated:a570863c3a6ac227b56c,PGC: Peak-Guided Calibration for Generalizable AI-Generated Image Detection,2026,Xiaoyu Zhou; Jianwei Fei; Peipeng Yu; Jingchang Xie; Chong Cheng; Zhihua Xia,International Conference on Machine Learning,venue:icml:main,International Conference on Machine Learning,ICML,conference,main,International Conference on Machine Learning (ICML),10.48550/arxiv.2605.21207,2605.21207,https://openalex.org/W7162011903,https://doi.org/10.48550/arxiv.2605.21207,conference,"The rapid evolution of generative AI, from GANs to modern diffusion models, has resulted in increasingly subtle discriminative clues. These fine-grained signals are often overshadowed by dominant, high-fidelity image content (e.g., the main subject), limiting the reliability of existing detectors that predominantly rely on global representations. To address this challenge, we propose the Peak-Guided Calibration (PGC) framework. PGC introduces a novel strategy that aggregates salient features via a peak-focusing mechanism. Specifically, by employing a peak-sensitive aggregation that accentuates the most discriminative local clues, PGC leverages these critical signals to calibrate the global decision. This approach recovers subtle patterns that would otherwise be submerged in the global context. Furthermore, to better simulate real-world threats, we introduce the CommGen15 dataset, a challenging benchmark comprising samples from 15 commercial models. Extensive experiments demonstrate that PGC achieves state-of-the-art performance. Specifically, it improves mean accuracy by +12.3% on our CommGen15 dataset, and sets new records on standard benchmarks, including GenImage (+2.1%), AIGI (+3.5%), and UniversalFakeDetect (+1.7%). Code is available at https://github.com/xiaoyu6868/PGC.",detection,ai_generated_image_detection,in_scope,openalex,openalex,manually_confirmed,reviewed,,2026-07-12T12:13:25Z,2026-07-12T12:13:25Z,method
curated:f380c0d31081fc59f1eb,FiSeR: Fine-Grained Source Representations for Cross-Domain AI Image Detection,2026,Shan Zhang; Yongxin He; Mingming Zhang; Huiwen Tian; Lei Ma,International Conference on Machine Learning,venue:icml:main,International Conference on Machine Learning,ICML,conference,main,International Conference on Machine Learning (ICML),10.48550/arxiv.2606.00606,2606.00606,https://openalex.org/W7163168192,https://doi.org/10.48550/arxiv.2606.00606,conference,"Real-world synthetic image detectors often generalize poorly under domain shift despite strong in-domain performance. Using unsupervised UMAP projections, we find that natural and synthetic features remain partially separable on unseen datasets, yet performance still drops, suggesting that the classification head overfits to training-domain artifacts. Therefore, the key is to learn more transferable representations so that the decision criterion is more stable and robust to domain shifts. Based on the structural fact that synthetic images are produced by diverse generators, we propose a hierarchical contrastive learning framework that improves the separability between natural and synthetic images while preserving generator identity information. It jointly optimizes (i) a coarse contrastive objective between natural and synthetic images and (ii) a fine contrastive objective among synthetic images using generator identities. Trained on WildFake, our method achieves an average AUROC gain of +10.22 on cross-domain evaluation over Chameleon, AIGIBench, Community Forensics, and GenImage under the same settings as the strong baseline DIRE. For few-shot adaptation, we freeze the backbone and fit an SVM head on 10 labeled samples per class, improving AUROC by +10.64 on AIGIBench and +17.41 on Chameleon, averaged over 12 widely used detectors. Our code is publicly available at: https://github.com/heyongxin233/FiSeR.",detection,ai_generated_image_detection,in_scope,openalex,openalex,manually_confirmed,reviewed,,2026-07-12T12:13:59Z,2026-07-12T12:13:59Z,method
curated:75cbd31c9946c7eb7977,"""That's another doom I haven't thought about"": A User Study on AI Labels as a Safeguard Against Image-Based Misinformation",2026,Sandra Höltervennhoff; Jonas Ricker; Maike M. Raphael; Charlotte Schwedes; Rebecca Weil; Asja Fischer; Thorsten Holz; Lea Schönherr; Sascha Fahl,CHI Conference on Human Factors in Computing Systems,venue:chi:main,CHI Conference on Human Factors in Computing Systems,CHI,conference,main,Proceedings of the 2026 CHI Conference on Human Factors in Computing Systems,https://doi.org/10.1145/3772318.3791006,2505.22845,https://openalex.org/W4416604008,https://doi.org/10.1145/3772318.3791006,conference,"As generative AI is increasingly contributing to the spread of deceptively realistic misinformation, lawmakers have introduced regulations requiring the disclosure of AI-generated content. However, it is unclear if labels reduce the risk of users falling for AI-generated misinformation. To address this research gap, we study the effect of labels on users’ perception and the implications of mislabeling, focusing on AI-generated images. We first explored users’ opinions and expectations of labels using five focus groups. Although participants were wary of practical implementations, they considered labeling helpful in identifying AI-generated images and avoiding deception. Second, we conducted a survey with 1 354 participants to assess how labels affect users’ ability to recognize misinformation. While labels reduced participants’ belief in false claims supported by AI-generated images, we found evidence of overreliance, leading to unintended side effects: Participants were more susceptible to false claims accompanied by human-made images, and were more hesitant to believe true claims illustrated with labeled AI-generated images.",detection,ai_generated_image_detection,in_scope,openalex,openalex,corrected_by_admin,reviewed,,2026-07-12T19:55:52Z,2026-07-12T19:56:05Z,analysis
curated:2938e895376a45baceec,SAGNet: Decoupling Semantic-Agnostic Artifacts From Limited Training Data for Robust Generalization in Deepfake Detection,2025,Renshuai Tao; Chuangchuang Tan; Huan Liu; Rongrong Ni; Yao Zhao,IEEE Transactions on Information Forensics and Security,venue:ieee-transactions-on-information-forensics-and-security:main,IEEE Transactions on Information Forensics and Security,TIFS,journal,main,IEEE Transactions on Information Forensics and Security,https://doi.org/10.1109/tifs.2025.3581726,,https://openalex.org/W4411484192,https://doi.org/10.1109/tifs.2025.3581726,journal,"Deepfake detection presents a significant challenge, particularly when the available training data is constrained to a limited set of semantic categories—a common and realistic scenario. In deepfake detection, the training labels typically indicate whether an image is real or fake, without specifying the semantic content, such as object classes. Moreover, we cannot know in advance the object categories present in an image to be detected. Ideally, a deepfake detection model should perform consistently across different semantic categories during inference, irrespective of the content. However, existing methods often exhibit significant performance bias between seen and unseen classes, struggling to generalize effectively. To address this issue, we propose Semantic-AGnostic artifact Network (SAGNet), an innovative and efficient approach designed to decouple semantic-agnostic artifacts from content-specific distributions in the training data. Our method eliminates semantic-specific biases, ensuring that the model focuses on universal artifacts related to image authenticity rather than content-dependent features. By employing this decoupling strategy, SAGNet greatly enhances the model’s generalization capacity, even when trained on limited data. Remarkably, through experiments, we demonstrate that SAGNet achieves performance comparable to models trained with 10 times more data, despite being trained on only 2 classes (comparing SAGNet trained on 2 classes with Ojha et al. (2023) trained on 20 categories). Furthermore, through extensive experiments, we show that SAGNet’s improvements are not only evident across different semantic categories but also extend to various generative methods, including multiple GAN-based and diffusion-based models. This cross-method generalization emphasizes SAGNet’s versatility and effectiveness in diverse generative scenarios. Overall, our method represents a significant advancement in deepfake detection, particularly in realistic situations where the training data is limited. The code is released at https://github.com/rstao-bjtu/SAGNet/.",detection,deepfake_image_detection,in_scope,openalex,openalex,manually_confirmed,reviewed,,2026-07-12T20:23:30Z,2026-07-12T20:23:44Z,method
curated:517a2cc4ca3690f3fc44,A Performance Analysis to Detect Synthetic Images with Deep Learning-Based Image Classification,2024,Vinay Gautam; Mukesh Joshi; Raj Gaurang Tiwari; Ambuj Kumar Agarwal; Naresh Kumar Trivedi,International Conference on Cyber Intelligence and Information Retrieval,venue:international-conference-on-cyber-intelligence-and-information-retrieval:main,International Conference on Cyber Intelligence and Information Retrieval,CIIR,conference,main,International Conference on Cyber Intelligence and Information Retrieval (CIIR),10.1007/978-981-97-3594-5_3,,https://openalex.org/W4400793389,https://doi.org/10.1007/978-981-97-3594-5_3,conference,"This study tackles the growing public concern about the spread of AI-generated images and their impact on public trust in the media and society. The ability to distinguish between true and fraudulent contents has grown increasingly difficult, resulting in the spread of misinformation and the possibility of disinformation operations. Deepfake technology, in particular, offers a huge risk since it generates incredibly realistic manufactured films and images. To address this issue, we suggest the creation of an AI-based system capable of distinguishing between actual and fraudulent photos. We use a deep learning-based convolutional neural network (CNN) architecture, which is well-known for its image classification skills. The research focuses on improving performance by optimising the CNN model and hyperparameters. A 120,000-image CIFAKE dataset is employed, with 60,000 AI-generated synthetic photos and 60,000 real-captured photographs. To test the efficiency of the trained model, performance evaluation metrics such as accuracy, precision, recall, and F1-score are used. With a high accuracy rate of 95.9%, the proposed method achieves remarkable outcomes in properly distinguishing between actual and AI-generated images. Furthermore, the model has high precision, recall, and F1-score values, suggesting its robustness in dealing with both types of images. The study provides light on the issues posed by AI-generated images’ rising sophistication and emphasises the necessity for automated solutions to tackle fraudulent content. This research contributes to sustaining public trust in media and limiting the harmful societal impacts of AI-generated disinformation by attaining a high level of accuracy in deepfake identification.",detection,synthetic_image_detection,in_scope,openalex,openalex,corrected_by_admin,reviewed,,2026-07-12T21:21:17Z,2026-07-12T21:21:31Z,analysis
