paper_id,title,year,authors,venue,venue_id,venue_name,venue_acronym,venue_type,venue_track,raw_venue,doi,arxiv_id,openalex_url,paper_url,publication_type,abstract,task,subtask,scope_status,source_database,metadata_source,curation_status,review_status,review_note,created_at,updated_at,entry_type
curated:f40ecaaf5d0212852b79,Dual Data Alignment Makes AI-Generated Image Detector Easier Generalizable,2025,Ruoxin Chen; Jing Xi; Zhiyuan Yan; Ke-Yue Zhang; Shuang Wu; Jingyi Xie; Xu Chen; Lei Xu; Isabel Y.N Guan; Taiping Yao; Shouhong Ding,Advances in Neural Information Processing Systems,venue:neurips:main,Advances in Neural Information Processing Systems,NeurIPS,conference,main,NeurIPS,10.48550/arxiv.2505.14359,2505.14359,https://openalex.org/W4416562145,https://openreview.net/pdf?id=C39ShJwtD5,conference,"Existing detectors are often trained on biased datasets, leading to the possibility of overfitting on non-causal image attributes that are spuriously correlated with real/synthetic labels. While these biased features enhance performance on the training data, they result in substantial performance degradation when applied to unbiased datasets. One common solution is to perform dataset alignment through generative reconstruction, matching the semantic content between real and synthetic images. However, we revisit this approach and show that pixel-level alignment alone is insufficient. The reconstructed images still suffer from frequency-level misalignment, which can perpetuate spurious correlations. To illustrate, we observe that reconstruction models tend to restore the high-frequency details lost in real images (possibly due to JPEG compression), inadvertently creating a frequency-level misalignment, where synthetic images appear to have richer high-frequency content than real ones. This misalignment leads to models associating high-frequency features with synthetic labels, further reinforcing biased cues. To resolve this, we propose Dual Data Alignment (DDA), which aligns both the pixel and frequency domains. Moreover, we introduce two new test sets: DDA-COCO, containing DDA-aligned synthetic images for testing detector performance on the most aligned dataset, and EvalGEN, featuring the latest generative models for assessing detectors under new generative architectures such as visual auto-regressive generators. Finally, our extensive evaluations demonstrate that a detector trained exclusively on DDA-aligned MSCOCO could improve across 8 diverse benchmarks by a non-trivial margin, showing a +7.2% on in-the-wild benchmarks, highlighting the improved generalizability of unbiased detectors. Our code is available at: https://github.com/roy-ch/Dual-Data-Alignment.",detection,ai_generated_image_detection,in_scope,openalex,openalex,manually_confirmed,reviewed,,2026-07-11T12:45:48Z,2026-07-11T12:45:48Z,method
curated:98bed92571e23d5df139,AI-Generated Image Detection: Challenges and Recent Advances,2026,Christos Koutlis; Riccardo Corvi; Davide Cozzolino; Quentin Bammey; Despina Konstantinidou; Manos Schinas; Dimitrios Karageorgiou; Luisa Verdoliva; Symeon Papadopoulos,,,,,,,,10.1007/978-3-032-11782-3_6,,https://openalex.org/W7159927480,https://doi.org/10.1007/978-3-032-11782-3_6,book,"Recent advances in the field of AI-based content generation in combination with the easy and widespread access to such tools can enhance disinformation campaigns with respect to plausibility and scale. This poses a significant threat to online information integrity, social trust, and even democratic processes. The rapid evolution of generative models demands robust and adaptable detection mechanisms. In this chapter, we outline the progress in the field of AI-Generated Image Detection (AIGID) including recent methods, relevant datasets, and assessment of existing methods’ performance. In addition, we discuss the challenges that the corresponding methods face such as performance drop in the wild due to post-processing operations, generalization to data from new generators, and transparency of detection workflow.",detection,ai_generated_image_detection,in_scope,openalex,openalex,manually_confirmed,reviewed,,2026-07-11T12:49:02Z,2026-07-12T20:01:45Z,
curated:27b6ffdee837c7f997f5,AEDR: Training-Free AI-Generated Image Attribution via Autoencoder Double-Reconstruction,2026,Chao Wang; Zijin Yang; Yaofei Wang; Weiming Zhang; Kejiang Chen,AAAI Conference on Artificial Intelligence,venue:aaai:main,AAAI Conference on Artificial Intelligence,AAAI,conference,main,Proceedings of the AAAI Conference on Artificial Intelligence,10.1609/aaai.v40i12.37930,2507.18988,https://openalex.org/W7138264983,https://doi.org/10.1609/aaai.v40i12.37930,conference,"The rapid advancement of image-generation technologies has made it possible for anyone to create photorealistic images using generative models, raising significant security concerns. To mitigate malicious use, tracing the origin of such images is essential. Reconstruction-based attribution methods offer a promising solution, but they often suffer from reduced accuracy and high computational costs when applied to state‑of‑the‑art (SOTA) models. To address these challenges, we propose AEDR (AutoEncoder Double-Reconstruction), a novel training‑free attribution method designed for generative models with continuous autoencoders. Unlike existing reconstruction‑based approaches that rely on the value of a single reconstruction loss, AEDR performs two consecutive reconstructions using the model’s autoencoder, and adopts the ratio of these two reconstruction losses as the attribution signal. This signal is further calibrated using the image homogeneity metric to improve accuracy, which inherently cancels out absolute biases caused by image complexity, with autoencoder‑based reconstruction ensuring superior computational efficiency. Experiments on eight top latent diffusion models show that AEDR achieves 25.5% higher attribution accuracy than existing reconstruction‑based methods, with requiring only 1% of the computational time.",detection,ai_generated_image_detection,in_scope,openalex,openalex,manually_confirmed,reviewed,,2026-07-11T12:50:38Z,2026-07-11T12:50:38Z,method
curated:f6ad15b01df18aadfe1a,PRADA: Probability-Ratio-Based Attribution and Detection of Autoregressive-Generated Images,2026,Simon Damm; Jonas Ricker; Henning Petzka; Asja Fischer,IEEE/CVF Conference on Computer Vision and Pattern Recognition,venue:cvpr:findings,IEEE/CVF Conference on Computer Vision and Pattern Recognition,CVPR,conference,findings,2026 IEEE/CVF Conference on Computer Vision and Pattern Recognition (CVPR) Findings,10.48550/arxiv.2511.20068,2511.20068,https://openalex.org/W4417082429,https://openaccess.thecvf.com/content/CVPR2026F/papers/Damm_PRADA_Probability-Ratio-Based_Attribution_and_Detection_of_Autoregressive-Generated_Images_CVPRF_2026_paper.pdf,conference,"Autoregressive (AR) image generation has recently emerged as a powerful paradigm for image synthesis. Leveraging the generation principle of large language models, they allow for efficiently generating deceptively real-looking images, further increasing the need for reliable detection methods. However, to date there is a lack of work specifically targeting the detection of images generated by AR image generators. In this work, we present PRADA (Probability-Ratio-Based Attribution and Detection of Autoregressive-Generated Images), a simple and interpretable approach that can reliably detect AR-generated images and attribute them to their respective source model. The key idea is to inspect the ratio of a model's conditional and unconditional probability for the autoregressive token sequence representing a given image. Whenever an image is generated by a particular model, its probability ratio shows unique characteristics which are not present for images generated by other models or real images. We exploit these characteristics for threshold-based attribution and detection by calibrating a simple, model-specific score function. Our experimental evaluation shows that PRADA is highly effective against eight class-to-image and four text-to-image models. We release our code and data at github.com/jonasricker/prada.",detection,ai_generated_image_detection,in_scope,openalex,openalex,manually_confirmed,reviewed,,2026-07-11T13:00:19Z,2026-07-11T13:00:19Z,method
curated:d4a9b3a3cef9bfbd0e32,Detecting AI-Generated Content on Social Media with Multi-modal Language Models,2026,Chenyang Yang; Shen Yan; Yibo Yang; Litao Hu; Yuchen Liu; Yuan Zeng; Hanchao Yu; Yinan Zhu; Sumedha Singla; Brian Vanover; Huijun Qian; Zihao Wang; Fujun Liu; Aashu Singh; Jianyu Wang; Xuewen Zhang,Annual Meeting of the Association for Computational Linguistics,venue:acl:industry,Annual Meeting of the Association for Computational Linguistics,ACL,conference,industry,Proceedings of the 64th Annual Meeting of the Association for Computational Linguistics (Volume 6: Industry Track),10.18653/v1/2026.acl-industry.15,2606.11200,https://openalex.org/W7166864343,https://doi.org/10.18653/v1/2026.acl-industry.15,conference,"Generative AI has enabled the creation of photorealistic images and videos that are increasingly disseminated on social media, often used for spam, misinformation, manipulation, and fraud. Existing AI-generated content (AIGC) detection methods face challenges including poor generalization to new generation models, reliance on single modalities, and lack of interpretable explanations. We present our pipeline that mitigates these issues by continuously curating diverse multi-modal social media data and training a compact vision-language model for detection and explanation. Our model achieves state-of-the-art detection performance on public benchmarks and demonstrates robust detection and explanation capabilities on internal social media datasets across multiple platforms. We deployed our model for post recommendation on social media platforms and observed positive downstream impacts on user engagement, demonstrating that it is feasible to perform effective AIGC detection in dynamic, real-world social media environments.",detection,ai_generated_image_detection,in_scope,openalex,openalex,manually_confirmed,reviewed,,2026-07-11T13:17:40Z,2026-07-11T13:17:40Z,method
curated:ba0669dd843c9defd483,Comparative Study of Adversarial Training and Randomized Smoothing for Robust AI-Generated Image Attribution,2026,Kai Zeng; Niccolò Pancino; Nasrin Malekzadeh Goradel; Mauro Barni; Benedetta Tondi,ACM Workshop on Information Hiding and Multimedia Security,venue:ih-mmsec:main,ACM Workshop on Information Hiding and Multimedia Security,IH&MMSec,conference,workshops,2026 ACM Workshop on Information Hiding and Multimedia Security (IH&MMSec),10.1145/3785353.3815073,,https://openalex.org/W7164888959,https://doi.org/10.1145/3785353.3815073,conference,"In this paper we explore two different approaches for designing AI-generated image attribution methods that are robust in adversarial settings, namely adversarial training (AT) and randomized smoothing (RS). While AT has been widely adopted in machine learning to improve the adversarial robustness of classifiers, its application to source image attribution is still unexplored. RS, on the other hand, has emerged as a method for developing deep learning classifiers with certified robustness, i.e., for which a certified level of robustness can be theoretically guaranteed, regardless of the specific manipulation causing the distortion. With the exception of a single prior study, its application to forensic tasks has not been previously explored. Experiments conducted on two datasets of AI-generated images show that both approaches achieve substantial adversarial robustness and exhibit a general resistance to common image manipulations. In particular, adversarial training provides stronger robustness against a broad range of post-processing operations, whereas randomized smoothing yields higher practical robustness against adversarial attacks.",source_attribution,source_identification,in_scope,openalex,openalex,manually_confirmed,reviewed,,2026-07-11T13:26:40Z,2026-07-12T11:55:46Z,analysis
curated:bb388762c1cb4bd3bf4a,Quality-Aware Calibration for AI-Generated Image Detection in the Wild,2026,Fabrizio Guillaro; Vincenzo De Rosa; Davide Cozzolino; Luisa Verdoliva,IEEE/CVF Conference on Computer Vision and Pattern Recognition,venue:cvpr:workshops,IEEE/CVF Conference on Computer Vision and Pattern Recognition,CVPR,conference,workshops,2026 IEEE/CVF Conference on Computer Vision and Pattern Recognition (CVPR) Workshops,10.48550/arxiv.2604.15027,2604.15027,https://openalex.org/W7154747266,https://openaccess.thecvf.com/content/CVPR2026W/APAI/papers/Guillaro_Quality-Aware_Calibration_for_AI-Generated_Image_Detection_in_the_Wild_CVPRW_2026_paper.pdf,conference,"Significant progress has been made in detecting synthetic images, however most existing approaches operate on a single image instance and overlook a key characteristic of real-world dissemination: as viral images circulate on the web, multiple near-duplicate versions appear and lose quality due to repeated operations like recompression, resizing and cropping. As a consequence, the same image may yield inconsistent forensic predictions based on which version has been analyzed. In this work, to address this issue we propose QuAD (Quality-Aware calibration with near-Duplicates) a novel framework that makes decisions based on all available near-duplicates of the same image. Given a query, we retrieve its online near-duplicates and feed them to a detector: the resulting scores are then aggregated based on the estimated quality of the corresponding instance. By doing so, we take advantage of all pieces of information while accounting for the reduced reliability of images impaired by multiple processing steps. To support large-scale evaluation, we introduce two datasets: AncesTree, an in-lab dataset of 136k images organized in stochastic degradation trees that simulate online reposting dynamics, and ReWIND, a real-world dataset of nearly 10k near-duplicate images collected from viral web content. Experiments on several state-of-the-art detectors show that our quality-aware fusion improves their performance consistently, with an average gain of around 8% in terms of balanced accuracy compared to plain average. Our results highlight the importance of jointly processing all the images available online to achieve reliable detection of AI-generated content in real-world applications. Code and data are publicly available at https://grip-unina.github.io/QuAD/",detection,ai_generated_image_detection,in_scope,openalex,openalex,manually_confirmed,reviewed,,2026-07-11T13:29:39Z,2026-07-11T13:29:39Z,method
curated:589870527983af575480,The Deployment Gap in AI Media Detection: Platform-Aware and Visually Constrained Adversarial Evaluation,2026,Aishwarya Budhkar; Trishita Dhara; Siddhesh Sheth,IEEE/CVF Conference on Computer Vision and Pattern Recognition,venue:cvpr:workshops,IEEE/CVF Conference on Computer Vision and Pattern Recognition,CVPR,conference,workshops,2026 IEEE/CVF Conference on Computer Vision and Pattern Recognition (CVPR) Workshops,,2604.09706,https://openalex.org/W7154539686,https://openaccess.thecvf.com/content/CVPR2026W/AIMS/papers/Budhkar_The_Deployment_Gap_in_AI_Media_Detection_Platform-Aware_and_Visually_CVPRW_2026_paper.pdf,conference,"Recent AI media detectors report near-perfect performance under clean laboratory evaluation, yet their robustness under realistic deployment conditions remains underexplored. In practice, AI-generated images are resized, compressed, re-encoded, and visually modified before being shared on online platforms. We argue that this creates a deployment gap between laboratory robustness and real-world reliability. In this work, we introduce a platform-aware adversarial evaluation framework for AI media detection that explicitly models deployment transforms (e.g., resizing, compression, screenshot-style distortions) and constrains perturbations to visually plausible meme-style bands rather than full-image noise. Under this threat model, detectors achieving AUC $\approx$ 0{.}99 in clean settings experience substantial degradation. Per-image platform-aware attacks reduce AUC to significantly lower levels and achieve high fake-to-real misclassification rates, despite strict visual constraints. We further demonstrate that universal perturbations exist even under localized band constraints, revealing shared vulnerability directions across inputs. Beyond accuracy degradation, we observe pronounced calibration collapse under attack, where detectors become confidently incorrect. Our findings highlight that robustness measured under clean conditions substantially overestimates deployment robustness. We advocate for platform-aware evaluation as a necessary component of future AI media security benchmarks and release our evaluation framework to facilitate standardized robustness assessment.",detection,ai_generated_image_detection,in_scope,openalex,openalex,manually_confirmed,reviewed,,2026-07-11T13:31:08Z,2026-07-11T13:31:08Z,method
curated:f7906cb987975444e893,Boosting Robust AIGI Detection with LoRA-based Pairwise Training,2026,Ruiyang Xia; Qi Zhang; Yaowen Xu; Zhaofan Zou; Hao Sun; Zhongjiang He; Xuelong Li,IEEE/CVF Conference on Computer Vision and Pattern Recognition,venue:cvpr:workshops,IEEE/CVF Conference on Computer Vision and Pattern Recognition,CVPR,conference,workshops,2026 IEEE/CVF Conference on Computer Vision and Pattern Recognition (CVPR) Workshops,10.48550/arxiv.2604.12307,2604.12307,https://openalex.org/W7154447485,https://openaccess.thecvf.com/content/CVPR2026W/NTIRE/papers/Xia_Boosting_Robust_AIGI_Detection_with_Lora-based_Pairwise_Training_CVPRW_2026_paper.pdf,conference,"The proliferation of highly realistic AI-Generated Image (AIGI) has necessitated the development of practical detection methods. While current AIGI detectors perform admirably on clean datasets, their detection performance frequently decreases when deployed ""in the wild"", where images are subjected to unpredictable, complex distortions. To resolve the critical vulnerability, we propose a novel LoRA-based Pairwise Training (LPT) strategy designed specifically to achieve robust detection for AIGI under severe distortions. The core of our strategy involves the targeted finetuning of a visual foundation model, the deliberate simulation of data distribution during the training phase, and a unique pairwise training process. Specifically, we introduce distortion and size simulations to better fit the distribution from the validation and test sets. Based on the strong visual representation capability of the visual foundation model, we finetune the model to achieve AIGI detection. The pairwise training is utilized to improve the detection via decoupling the generalization and robustness optimization. Experiments show that our approach secured the 3th placement in the NTIRE Robust AI-Generated Image Detection in the Wild challenge",detection,ai_generated_image_detection,in_scope,openalex,openalex,manually_confirmed,reviewed,,2026-07-11T13:33:10Z,2026-07-11T13:33:10Z,method
curated:efceafb2be2246aa120b,Weakly‐Aligned Region‐Language Transformer for Real‐Time Artistic Content Detection in SAGIN,2025,Jiayue Yu; Sudip Kumar Sahana,Transactions on Emerging Telecommunications Technologies,venue:transactions-on-emerging-telecommunications-technologies:main,Transactions on Emerging Telecommunications Technologies,,journal,main,Transactions on Emerging Telecommunications Technologies,10.1002/ett.70335,,https://openalex.org/W7117628628,https://doi.org/10.1002/ett.70335,journal,"ABSTRACT The Space–Air–Ground Integrated Network (SAGIN) enables seamless connectivity across satellite, aerial, and terrestrial nodes. However, its heterogeneous architecture, resource‐constrained nodes, and dynamic link conditions pose significant challenges for deploying deep learning models‐particularly for detecting AI‐generated artistic content. These challenges include limited on‐board computational capacity, fluctuating bandwidth, and the requirement for fine‐grained visual‐semantic reasoning under weak supervision. To overcome these limitations, we propose the Weakly‐Aligned Region‐Language Transformer (WARL‐Transformer), a novel framework designed for robust AI‐generated content detection under realistic SAGIN constraints. WARL‐Transformer incorporates: (1) A vision‐language alignment mechanism that integrates local visual features with high‐level semantic cues derived from textual descriptions, and (2) a weakly supervised local feature alignment strategy that learns region‐language correspondences without relying on costly fine‐grained annotations. Laboratory‐based SAGIN emulation experiments further verify that WARL‐Transformer maintains high detection accuracy across diverse artistic styles while preserving robustness against network interference. In particular, WARL‐Transformer achieves an F1‐score of 96.78%, outperforming the baseline by +0.63 percentage points, and even under bandwidth‐constrained SAGIN emulation still reaches 99.7% of the full‐model F1, demonstrating strong robustness. This work establishes a foundation for reliable AI‐generated content detection in resource‐limited SAGIN settings, bridging the gap between visual content authentication and practical network‐driven constraints.",detection,ai_generated_image_detection,in_scope,openalex,openalex,manually_confirmed,reviewed,,2026-07-11T13:45:24Z,2026-07-11T13:45:24Z,method
curated:8ffdbd0ba264927d1c3a,Robust Fake Image Detection via Incremental Training of Siamese Neural Networks,2025,Aniello Castiglione; Lucia Cimmino; Michele Nappi; Matteo Polsinelli; Carlo Sorrentino,International Symposium on Cyberspace Safety and Security,venue:international-symposium-on-cyberspace-safety-and-security:main,International Symposium on Cyberspace Safety and Security,CSS,conference,main,International Symposium on Cyberspace Safety and Security (CSS),10.1007/978-981-95-3551-4_23,,https://openalex.org/W7118011364,https://doi.org/10.1007/978-981-95-3551-4_23,conference,"The rapid advancement of generative models, particularly Generative Adversarial Networks (GANs) and Diffusion Models (DMs), has enabled the creation of highly realistic synthetic images that are increasingly difficult to distinguish from authentic ones. This progress presents significant challenges for digital content authentication. Furthermore, deepfake technologies are being actively exploited in cybersecurity attacks, introducing serious risks to information security. The use of hyper-realistic synthetic media in social engineering dramatically enhances the effectiveness of attacks such as identity theft and ransomware. Existing Deep Learning (DL)-based detectors often struggle to generalize to previously unseen generative techniques. To overcome this limitation, we propose a novel detection framework based on Siamese Neural Networks (SNNs), which focus on learning the similarity between image pairs rather than relying on fixed class boundaries. The proposed architecture is coupled with an incremental training strategy, where generators that yield the lowest detection performance are progressively incorporated into the training process. This enables the model to adapt more effectively to a diverse and evolving range of synthetic content. Experimental results show that strong generalization can be achieved using training data from as few as two generators, demonstrating the efficiency and scalability of the proposed approach. However, it is also observed that increasing the number of generators beyond a certain point does not lead to further improvements in performance. This indicates potential limitations in the current SNN training process. Future research will focus on refining training strategies to further improve generalization capabilities.",detection,ai_generated_image_detection,in_scope,openalex,openalex,manually_confirmed,reviewed,,2026-07-11T13:48:55Z,2026-07-11T13:48:55Z,method
